{"$defs":{"artifact_type":{"enum":["model_weights","model_config","tokenizer","generation_config","chat_template","prompt_formatter","serving_stack","container_image","cuda_lib","kernel_library","network_stack_binary","pmd_driver","runtime_knob_set","request_set","batching_policy","nic_link_config","collective_stack","compiled_extension","remote_code"],"type":"string"},"audit_config":{"additionalProperties":false,"properties":{"token_commitment":{"additionalProperties":false,"properties":{"algorithm":{"enum":["hmac-sha256"],"type":"string"},"enabled":{"type":"boolean"},"key_source":{"enum":["inline-shared"],"type":"string"}},"required":["enabled"],"type":"object"}},"required":["token_commitment"],"type":"object"},"comparator":{"additionalProperties":false,"allOf":[{"if":{"properties":{"mode":{"const":"ulp"}},"required":["mode"]},"then":{"required":["ulp"]}},{"if":{"properties":{"mode":{"const":"absrel"}},"required":["mode"]},"then":{"required":["atol","rtol"]}},{"if":{"properties":{"mode":{"const":"hash"}},"required":["mode"]},"then":{"required":["algorithm"]}}],"properties":{"algorithm":{"enum":["sha256"],"type":"string"},"atol":{"minimum":0,"type":"number"},"mode":{"enum":["exact","ulp","absrel","hash"],"type":"string"},"rtol":{"minimum":0,"type":"number"},"ulp":{"minimum":0,"type":"integer"}},"required":["mode"],"type":"object"}},"$schema":"https://json-schema.org/draft/2020-12/schema","additionalProperties":false,"properties":{"artifact_inputs":{"items":{"additionalProperties":false,"properties":{"artifact_id":{"pattern":"^[A-Za-z0-9._:-]+$","type":"string"},"artifact_type":{"$ref":"#/$defs/artifact_type"},"expected_digest":{"pattern":"^sha256:[a-f0-9]{64}$","type":"string"},"immutable_ref":{"minLength":1,"type":"string"},"name":{"type":"string"},"path":{"minLength":1,"type":"string"},"role":{"enum":["weights_shard","config","tokenizer","generation_config","chat_template","prompt_formatter"],"type":"string"},"size_bytes":{"minimum":1,"type":"integer"},"source_kind":{"enum":["hf","oci","s3","http","git","nix","inline"],"type":"string"},"source_uri":{"type":"string"}},"required":["artifact_id","artifact_type","source_kind","source_uri","immutable_ref"],"type":"object"},"type":"array"},"audit":{"$ref":"#/$defs/audit_config"},"comparison":{"additionalProperties":false,"properties":{"logits":{"$ref":"#/$defs/comparator"},"network_egress":{"$ref":"#/$defs/comparator"},"tokens":{"$ref":"#/$defs/comparator"}},"required":["tokens","logits"],"type":"object"},"created_at":{"format":"date-time","type":"string"},"hardware_profile":{"additionalProperties":false,"properties":{"gpu":{"additionalProperties":false,"properties":{"count":{"minimum":1,"type":"integer"},"cuda_driver_version":{"minLength":1,"type":"string"},"driver_version":{"minLength":1,"type":"string"},"model":{"minLength":1,"type":"string"}},"required":["model","count","driver_version","cuda_driver_version"],"type":"object"}},"required":["gpu"],"type":"object"},"manifest_version":{"const":"v1","type":"string"},"model":{"additionalProperties":false,"properties":{"source":{"pattern":"^hf://[A-Za-z0-9._-]+/[A-Za-z0-9._-]+$","type":"string"},"tokenizer_revision":{"pattern":"^[a-f0-9]{40}$","type":"string"},"trust_remote_code":{"type":"boolean"},"weights_revision":{"pattern":"^[a-f0-9]{40}$","type":"string"}},"required":["source","tokenizer_revision","weights_revision","trust_remote_code"],"type":"object"},"requests":{"items":{"additionalProperties":false,"properties":{"id":{"pattern":"^[A-Za-z0-9._:-]+$","type":"string"},"max_new_tokens":{"minimum":1,"type":"integer"},"prompt":{"minLength":1,"type":"string"},"temperature":{"maximum":2,"minimum":0,"type":"number"}},"required":["id","prompt","max_new_tokens","temperature"],"type":"object"},"minItems":1,"type":"array"},"run_id":{"pattern":"^[A-Za-z0-9][A-Za-z0-9._-]{2,127}$","type":"string"},"runtime":{"additionalProperties":false,"properties":{"batch_invariance":{"additionalProperties":false,"properties":{"enabled":{"type":"boolean"},"enforce_eager":{"type":"boolean"}},"required":["enabled","enforce_eager"],"type":"object"},"closure_hash":{"pattern":"^sha256:[a-f0-9]{64}$","type":"string"},"deterministic_knobs":{"additionalProperties":false,"properties":{"cublas_workspace_config":{"type":"string"},"cuda_launch_blocking":{"type":"boolean"},"pythonhashseed":{"type":"string"},"seed":{"minimum":0,"type":"integer"},"torch_deterministic":{"type":"boolean"}},"required":["seed","torch_deterministic","cuda_launch_blocking"],"type":"object"},"serving_engine":{"additionalProperties":false,"properties":{"attention_backend":{"enum":["FLASH_ATTN","TRITON_ATTN","FLASH_ATTN_MLA","TRITON_MLA"],"type":"string"},"block_size":{"minimum":1,"type":["integer","null"]},"disable_custom_all_reduce":{"type":"boolean"},"disable_sliding_window":{"type":"boolean"},"distributed_executor_backend":{"enum":["ray","mp"],"type":"string"},"dtype":{"enum":["auto","float16","bfloat16","float32"],"type":"string"},"enable_chunked_prefill":{"type":"boolean"},"enable_prefix_caching":{"type":"boolean"},"gpu_memory_utilization":{"maximum":1,"minimum":0.1,"type":"number"},"kv_cache_dtype":{"enum":["auto","fp8","int8"],"type":"string"},"load_format":{"enum":["auto","safetensors","pt","gguf"],"type":"string"},"max_model_len":{"minimum":1,"type":"integer"},"max_num_batched_tokens":{"minimum":1,"type":["integer","null"]},"max_num_seqs":{"minimum":1,"type":"integer"},"pipeline_parallel_size":{"minimum":1,"type":"integer"},"quantization":{"enum":["awq","gptq","bitsandbytes","fp8",null],"type":["string","null"]},"scheduling_policy":{"enum":["fcfs","priority"],"type":"string"},"tensor_parallel_size":{"minimum":1,"type":"integer"}},"required":["max_model_len","max_num_seqs","gpu_memory_utilization","dtype","attention_backend"],"type":"object"},"strict_hardware":{"type":"boolean"}},"required":["strict_hardware","batch_invariance","deterministic_knobs","serving_engine"],"type":"object"}},"required":["manifest_version","run_id","created_at","model","runtime","hardware_profile","requests","comparison","artifact_inputs"],"title":"manifest.v1","type":"object"}
