{"artifact_inputs":[{"artifact_id":"model-weights","artifact_type":"model_weights","expected_digest":"sha256:aaaaaaaaaaaaaaaaaaaaaaaaaaaaaaaaaaaaaaaaaaaaaaaaaaaaaaaaaaaaaaaa","immutable_ref":"aaaaaaaaaaaaaaaaaaaaaaaaaaaaaaaaaaaaaaaa","name":"weights","size_bytes":1000,"source_kind":"hf","source_uri":"hf://org/model/model-00001.safetensors"},{"artifact_id":"model-config","artifact_type":"model_config","expected_digest":"sha256:bbbbbbbbbbbbbbbbbbbbbbbbbbbbbbbbbbbbbbbbbbbbbbbbbbbbbbbbbbbbbbbb","immutable_ref":"aaaaaaaaaaaaaaaaaaaaaaaaaaaaaaaaaaaaaaaa","name":"config","size_bytes":200,"source_kind":"hf","source_uri":"hf://org/model/config.json"},{"artifact_id":"tokenizer","artifact_type":"tokenizer","expected_digest":"sha256:cccccccccccccccccccccccccccccccccccccccccccccccccccccccccccccccc","immutable_ref":"bbbbbbbbbbbbbbbbbbbbbbbbbbbbbbbbbbbbbbbb","name":"tokenizer","size_bytes":300,"source_kind":"hf","source_uri":"hf://org/model/tokenizer.json"},{"artifact_id":"serving-stack","artifact_type":"serving_stack","expected_digest":"sha256:1111111111111111111111111111111111111111111111111111111111111111","immutable_ref":"sha256:1111111111111111111111111111111111111111111111111111111111111111","name":"vllm-stack","size_bytes":2000,"source_kind":"oci","source_uri":"oci://registry.example/vllm@sha256:1111111111111111111111111111111111111111111111111111111111111111"},{"artifact_id":"cuda-lib","artifact_type":"cuda_lib","expected_digest":"sha256:2222222222222222222222222222222222222222222222222222222222222222","immutable_ref":"sha256:2222222222222222222222222222222222222222222222222222222222222222","name":"cuda-user-space","size_bytes":3000,"source_kind":"oci","source_uri":"oci://registry.example/cuda@sha256:2222222222222222222222222222222222222222222222222222222222222222"},{"artifact_id":"kernel-lib","artifact_type":"kernel_library","expected_digest":"sha256:3333333333333333333333333333333333333333333333333333333333333333","immutable_ref":"sha256:3333333333333333333333333333333333333333333333333333333333333333","name":"flash-attn","size_bytes":400,"source_kind":"s3","source_uri":"s3://mirror/flash-attn.whl"},{"artifact_id":"runtime-knobs","artifact_type":"runtime_knob_set","expected_digest":"sha256:6666666666666666666666666666666666666666666666666666666666666666","immutable_ref":"v1","name":"runtime-knobs","size_bytes":64,"source_kind":"inline","source_uri":"inline://runtime-knobs"},{"artifact_id":"request-set","artifact_type":"request_set","expected_digest":"sha256:7777777777777777777777777777777777777777777777777777777777777777","immutable_ref":"v1","name":"requests","size_bytes":64,"source_kind":"inline","source_uri":"inline://requests"},{"artifact_id":"compiled-ext","artifact_type":"compiled_extension","expected_digest":"sha256:abababababababababababababababababababababababababababababababab","immutable_ref":"sha256:aaaaaaaaaaaaaaaaaaaaaaaaaaaaaaaaaaaaaaaaaaaaaaaaaaaaaaaaaaaaaaaa","name":"xformers","size_bytes":700,"source_kind":"s3","source_uri":"s3://mirror/xformers.whl"}],"comparison":{"logits":{"atol":1e-06,"mode":"absrel","rtol":0.0001},"network_egress":{"algorithm":"sha256","mode":"hash"},"tokens":{"mode":"exact"}},"created_at":"2026-03-05T00:00:00Z","hardware_profile":{"gpu":{"count":1,"cuda_driver_version":"12.4","driver_version":"550.54.15","model":"H100-SXM-80GB"}},"manifest_version":"v1","model":{"source":"hf://org/model","tokenizer_revision":"bbbbbbbbbbbbbbbbbbbbbbbbbbbbbbbbbbbbbbbb","trust_remote_code":false,"weights_revision":"cccccccccccccccccccccccccccccccccccccccc"},"requests":[{"id":"req-1","max_new_tokens":8,"prompt":"Hello deterministic world","temperature":0},{"id":"req-2","max_new_tokens":8,"prompt":"Audit every run","temperature":0}],"run_id":"run-0001","runtime":{"batch_invariance":{"enabled":true,"enforce_eager":true},"deterministic_knobs":{"cuda_launch_blocking":true,"seed":42,"torch_deterministic":true},"serving_engine":{"attention_backend":"FLASH_ATTN","dtype":"auto","gpu_memory_utilization":0.9,"max_model_len":8192,"max_num_seqs":256},"strict_hardware":true}}
