{"artifact_inputs":[{"artifact_id":"hf-weights_shard-model-00001-of-00002.safetensors","artifact_type":"model_weights","expected_digest":"sha256:169ad53ec313c3a34b06c0809216e4fc072cce444a5d4ff2b59690d064130ed5","immutable_ref":"70d244cc86ccca08cf5af4e1e306ecf908b1ad5e","name":"model-00001-of-00002.safetensors","path":"model-00001-of-00002.safetensors","role":"weights_shard","size_bytes":3441185608,"source_kind":"hf","source_uri":"hf://Qwen/Qwen3-1.7B/model-00001-of-00002.safetensors"},{"artifact_id":"hf-weights_shard-model-00002-of-00002.safetensors","artifact_type":"model_weights","expected_digest":"sha256:912becff8d60672aa8628ef08c05898d9adf17c2ad4ae3caf99b065622fdeff9","immutable_ref":"70d244cc86ccca08cf5af4e1e306ecf908b1ad5e","name":"model-00002-of-00002.safetensors","path":"model-00002-of-00002.safetensors","role":"weights_shard","size_bytes":622329984,"source_kind":"hf","source_uri":"hf://Qwen/Qwen3-1.7B/model-00002-of-00002.safetensors"},{"artifact_id":"hf-config-config.json","artifact_type":"model_config","expected_digest":"sha256:1ddb5b89ebc90dcb417a45c213d818577e65976454d29385c8f6140771d95197","immutable_ref":"70d244cc86ccca08cf5af4e1e306ecf908b1ad5e","name":"config.json","path":"config.json","role":"config","size_bytes":726,"source_kind":"hf","source_uri":"hf://Qwen/Qwen3-1.7B/config.json"},{"artifact_id":"hf-tokenizer-tokenizer.json","artifact_type":"tokenizer","expected_digest":"sha256:aeb13307a71acd8fe81861d94ad54ab689df773318809eed3cbe794b4492dae4","immutable_ref":"70d244cc86ccca08cf5af4e1e306ecf908b1ad5e","name":"tokenizer.json","path":"tokenizer.json","role":"tokenizer","size_bytes":11422654,"source_kind":"hf","source_uri":"hf://Qwen/Qwen3-1.7B/tokenizer.json"},{"artifact_id":"hf-generation_config-generation_config.json","artifact_type":"generation_config","expected_digest":"sha256:2325da0f15bb848e018c5ae071b7943332e9f871d6b60e2ed22ca97d4cb993d2","immutable_ref":"70d244cc86ccca08cf5af4e1e306ecf908b1ad5e","name":"generation_config.json","path":"generation_config.json","role":"generation_config","size_bytes":239,"source_kind":"hf","source_uri":"hf://Qwen/Qwen3-1.7B/generation_config.json"},{"artifact_id":"hf-chat_template-tokenizer_config.json","artifact_type":"chat_template","expected_digest":"sha256:d5d09f07b48c3086c508b30d1c9114bd1189145b74e982a265350c923acd8101","immutable_ref":"70d244cc86ccca08cf5af4e1e306ecf908b1ad5e","name":"tokenizer_config.json","path":"tokenizer_config.json","role":"chat_template","size_bytes":9732,"source_kind":"hf","source_uri":"hf://Qwen/Qwen3-1.7B/tokenizer_config.json"},{"artifact_id":"hf-prompt_formatter-tokenizer_config.json","artifact_type":"prompt_formatter","expected_digest":"sha256:d5d09f07b48c3086c508b30d1c9114bd1189145b74e982a265350c923acd8101","immutable_ref":"70d244cc86ccca08cf5af4e1e306ecf908b1ad5e","name":"tokenizer_config.json","path":"tokenizer_config.json","role":"prompt_formatter","size_bytes":9732,"source_kind":"hf","source_uri":"hf://Qwen/Qwen3-1.7B/tokenizer_config.json"}],"comparison":{"logits":{"atol":1e-06,"mode":"absrel","rtol":0.0001},"network_egress":{"algorithm":"sha256","mode":"hash"},"tokens":{"mode":"exact"}},"created_at":"2026-03-26T00:00:00Z","hardware_profile":{"gpu":{"count":1,"cuda_driver_version":"12.8","driver_version":"570.148.08","model":"NVIDIA GH200 480GB"}},"manifest_version":"v1","model":{"source":"hf://Qwen/Qwen3-1.7B","tokenizer_revision":"70d244cc86ccca08cf5af4e1e306ecf908b1ad5e","trust_remote_code":false,"weights_revision":"70d244cc86ccca08cf5af4e1e306ecf908b1ad5e"},"requests":[{"id":"req-warmup","max_new_tokens":4,"prompt":"Hello","temperature":0},{"id":"req-determinism-1","max_new_tokens":32,"prompt":"The capital of France is","temperature":0},{"id":"req-determinism-2","max_new_tokens":64,"prompt":"Explain quantum computing in one sentence:","temperature":0},{"id":"req-determinism-3","max_new_tokens":128,"prompt":"Write a Python function that computes the factorial of n:","temperature":0},{"id":"req-long-output","max_new_tokens":8000,"prompt":"Write a detailed technical explanation of how transformer neural networks work.","temperature":0}],"run_id":"qwen3-1.7b-gh200-001","runtime":{"batch_invariance":{"enabled":true,"enforce_eager":true},"deterministic_knobs":{"cublas_workspace_config":":4096:8","cuda_launch_blocking":true,"pythonhashseed":"0","seed":42,"torch_deterministic":true},"serving_engine":{"attention_backend":"TRITON_ATTN","dtype":"auto","gpu_memory_utilization":0.9,"max_model_len":8192,"max_num_seqs":256},"strict_hardware":false}}
